domain,subdomain,category,resource_type,title,organization,url,jurisdiction,notes,authority_tier,source,contexts_count
General,Uncategorized,URLs,URL,Business Intelligence Vs. Data Analytics: Key Differences,,www.thoughtspot.com/data-trends/business-intelligence/business-intelligence-vs-data-analytics,,,tertiary,doc,1
Tax,General,URLs,URL PDF,[PDF] Investment Funds: Taxation of Carried Interest and Management Fees,,www.troutman.com/wp-content/uploads/2024/05/Munich-Conference-Investment-Funds_-Taxation-of-Carried-Interest-and-Management-Fees-4.2024-1.pdf,,,secondary,doc,1
Markets,Investing,URLs,URL,Evolving the family investment committee - UBS,,www.ubs.com/us/en/wealth-management/our-solutions/private-wealth-management/insights/articles/evolving-the-family-investment-committee.html,,,tertiary,doc,1
Compliance,General,URLs,URL,KYC vs. AML: What is the Difference? - Blog - Unit21,,www.unit21.ai/blog/kyc-vs-aml-difference,,,tertiary,doc,1
Compliance,Risk,URLs,URL,Implementing an Enterprise Risk Framework: A Comprehensive Guide,,www.urmia.org/blogs/gerard-hughes/2024/06/24/implementing-an-enterprise-risk-framework-a-compre,,,tertiary,doc,1
Banking,General,URLs,URL,SBA Loans & Financing - U.S. Bank,,www.usbank.com/business-banking/banking-products/business-lending/business-loans/sba-loan.html,,,tertiary,doc,1
Wealth,Management,URLs,URL,Relationship Manager- Wealth Management - Vanguard careers,,www.vanguardjobs.com/job/22527462/relationship-manager-wealth-management-dallas-tx/,,,tertiary,doc,1
Professional,Career,URLs,URL,Client services opportunities | Vanguard careers,,www.vanguardjobs.com/our-teams/client-services/,,,tertiary,doc,1
Markets,Investing,URLs,URL,Front office/Middle office/Back office | Wall Street Oasis,,www.wallstreetoasis.com/forum/investment-banking/front-officemiddle-officeback-office,,,tertiary,doc,1
Banking,General,URLs,URL,Commercial Banking - Relationship Manager - Wall Street Oasis,,www.wallstreetoasis.com/forum/other/commercial-banking-relationship-manager,,,tertiary,doc,1
Technology,FinTech,URLs,URL,Capital Structure | Formula + Calculator - Wall Street Prep,,www.wallstreetprep.com/knowledge/capital-structure/,,,tertiary,doc,1
Markets,Private,URLs,URL,Venture Capital Due Diligence (VC) | Startup Checklist,,www.wallstreetprep.com/knowledge/venture-capital-diligence/,,,tertiary,doc,1
Wealth,Management,URLs,URL,Advisor Designations and What They Mean | Wealthspire,,www.wealthspire.com/blog/advisor-designations-and-what-they-mean/,,,tertiary,doc,1
Banking,General,URLs,URL,How Credit Unions Differ from Banks,,www.weststar.org/resources/education/blog/blog-detail.html?title=how-credit-unions-differ-from-banks,,,tertiary,doc,1
Wealth,Management,URLs,URL,Wealth Relationship Manager: Roles & Responsibilities - Workassist.in,,www.workassist.in/blog/wealth-relationship-manager-roles-and-responsibilities-1724331181,,,tertiary,doc,1
Business,Finance,URLs,URL,"Essentials of Business Valuation, Part 1—Introduction ... - YouTube",,www.youtube.com/watch?v=8oeh3EOvKi8,,,tertiary,doc,1
Insurance,General,URLs,URL,The BEST General Insurance Life & Health Study Guide - YouTube,,www.youtube.com/watch?v=EEouuH87vAg,,,tertiary,doc,1
Credentials,Professional,URLs,URL,CPA Exam Prep (Becker vs Gleim vs Surgent vs UWorld) - YouTube,,www.youtube.com/watch?v=gQHGfbdNvyA,,,tertiary,doc,1
Credentials,Professional,URLs,URL,CVA Practice Test 2026 Certified Valuation Analyst Exam Questions ...,,www.youtube.com/watch?v=vpV1tM193J4,,,tertiary,doc,1
Technology,FinTech,URLs,URL,Funding When Capital Isn't Cheap | Andreessen Horowitz,a16z.com,https://a16z.com/funding-when-capital-isnt-cheap/,,,tertiary,doc,1
Banking,General,URLs,URL,Evaluating Compliance Based Crime Prevention in Lahore’s Banks: A Criminological Study of KYC and AML Tools against Digital Financial Offences,academia.edu.pk,https://academia.edu.pk/index.php/Journals/article/view/912,,,tertiary,doc,1
General,Uncategorized,URLs,Journal article,Home haemoglobin monitoring: adapting to the times,academic.oup.com,https://academic.oup.com/ckj/article/14/3/1029/5899259,,,tertiary,doc,1
Markets,Investing,URLs,URL PDF,THE USE OF POTENTIAL OF HEDGE FUNDS FOR UKRAINIAN INVESTORS,acadrev.duan.edu.ua,https://acadrev.duan.edu.ua/images/PDF/2021/1/12.pdf,,,tertiary,doc,1
Wealth,Planning,URLs,URL,Guide to Business Succession Planning Services - Advisor Legacy,advisorlegacy.com,https://advisorlegacy.com/blog/guide-to-business-succession-planning-services,,,tertiary,doc,1
Wealth,Management,URLs,URL,The family office structure: A comprehensive guide - Aleta,aleta.io,https://aleta.io/knowledge-hub/the-family-office-structure,,,tertiary,doc,1
Wealth,Planning,URLs,URL,The Value of a Philanthropic Advisor in Growing Your Impact,alysterling.com,https://alysterling.com/philanthropic-advisor/,,,tertiary,doc,1
Insurance,General,URLs,URL,Study Materials for the National or Federal Insurance Exam,americasprofessor.com,https://americasprofessor.com/general/study-materials-for-the-national-or-federal-insurance-exam/,,,tertiary,doc,1
Credentials,Professional,URLs,URL,"CFA Level 1, 2 & 3 Prep Course - AnalystPrep",analystprep.com,https://analystprep.com/shop/all-3-levels-of-the-cfa-exam-complete-course-by-analystprep/,,,tertiary,doc,1
Compliance,Risk,URLs,URL,"Family Governance - CFA, FRM, and Actuarial Exams Study Notes",analystprep.com,https://analystprep.com/study-notes/cfa-level-iii/family-governance/,,,tertiary,doc,1
Wealth,Management,URLs,URL,A Simple guide to family office structure,andsimple.co,https://andsimple.co/guides/family-office-structure/,,,tertiary,doc,1
Credentials,Professional,URLs,Paper PDF,Exam Questions,arxiv.org,http://arxiv.org/pdf/1905.13350.pdf,,,tertiary,doc,1
Credentials,Professional,URLs,Paper PDF,GPT as Knowledge Worker: A Zero-Shot Evaluation of (AI)CPA Capabilities,arxiv.org,http://arxiv.org/pdf/2301.04408v1.pdf,,,tertiary,doc,1
General,Uncategorized,URLs,Paper PDF,Health,arxiv.org,http://arxiv.org/pdf/2405.01789.pdf,,,tertiary,doc,1
Credit,Consumer,URLs,Paper PDF,Phase transitions in debt recycling,arxiv.org,http://arxiv.org/pdf/2405.19104.pdf,,,tertiary,doc,1
Markets,Investing,URLs,Paper PDF,Delegated portfolio management with random default,arxiv.org,http://arxiv.org/pdf/2410.13103.pdf,,,tertiary,doc,1
General,Uncategorized,URLs,Paper PDF,Impact of Resource Sharing on IT Security,arxiv.org,http://arxiv.org/pdf/2410.15194.pdf,,,tertiary,doc,1
General,Uncategorized,URLs,Paper PDF,novel mortgage assistance products,arxiv.org,http://arxiv.org/pdf/2411.00563.pdf,,,tertiary,doc,1
General,Uncategorized,URLs,Paper PDF,Legal Question Answering,arxiv.org,http://arxiv.org/pdf/2412.19482.pdf,,,tertiary,doc,1
Markets,Investing,URLs,Paper PDF,Dynamic loan portfolio management in a three time step model,arxiv.org,http://arxiv.org/pdf/2501.07856.pdf,,,tertiary,doc,1
Credentials,Professional,URLs,Paper PDF,Reasoning in the Multi-state Bar Exam,arxiv.org,http://arxiv.org/pdf/2504.04945.pdf,,,tertiary,doc,1
Technology,FinTech,URLs,Paper PDF,Cybersecurity threats in FinTech: A systematic review,arxiv.org,https://arxiv.org/ftp/arxiv/papers/2312/2312.01752.pdf,,,tertiary,doc,1
General,Uncategorized,URLs,Paper PDF,Client Profiling for an Anti-Money Laundering System,arxiv.org,https://arxiv.org/pdf/1510.00878.pdf,,,tertiary,doc,1
Credentials,Professional,URLs,Paper PDF,Passing the Brazilian OAB Exam: data preparation and some experiments,arxiv.org,https://arxiv.org/pdf/1712.05128.pdf,,,tertiary,doc,1
Compliance,General,URLs,Paper PDF,KYChain: User-Controlled KYC Data Sharing and Certification,arxiv.org,https://arxiv.org/pdf/2001.01659.pdf,,,tertiary,doc,1
General,Uncategorized,URLs,Paper PDF,Blockchain-Based Self-Sovereign Identity,arxiv.org,https://arxiv.org/pdf/2112.01237.pdf,,,tertiary,doc,1
General,Uncategorized,URLs,Paper PDF,Inclusion,arxiv.org,https://arxiv.org/pdf/2112.09767.pdf,,,tertiary,doc,1
Credentials,Professional,URLs,Paper PDF,GPT Takes the Bar Exam,arxiv.org,https://arxiv.org/pdf/2212.14402.pdf,,,tertiary,doc,1
General,Uncategorized,URLs,Paper PDF,Graph Enhanced Mixture-of-Experts Large Language Model,arxiv.org,https://arxiv.org/pdf/2306.16092.pdf,,,tertiary,doc,1
Tax,General,URLs,Paper PDF,Optimal fees in hedge funds with first-loss compensation,arxiv.org,https://arxiv.org/pdf/2310.19023.pdf,,,secondary,doc,1
General,Uncategorized,URLs,Paper PDF,Relief Analysis,arxiv.org,https://arxiv.org/pdf/2402.17932.pdf,,,tertiary,doc,1
Wealth,Management,URLs,URL,"Family Office Governance: Structure, Framework & Best Practices",asora.com,https://asora.com/blog/part-6-create-a-family-office-governance-structure/,,,tertiary,doc,1
General,Uncategorized,URLs,URL PDF,"Toward a Resident Personal Finance Curriculum: Quantifying Resident Financial Circumstances, Needs, and Interests",assets.cureus.com,https://assets.cureus.com/uploads/original_article/pdf/11856/1566922235-20190827-2455-19rdqxc.pdf,,,tertiary,doc,1
General,Uncategorized,URLs,URL PDF,Implementation of a Comprehensive Curriculum in Personal Finance for Medical Fellows,assets.cureus.com,https://assets.cureus.com/uploads/original_article/pdf/9787/1519929824-20180301-147-uwohzw.pdf,,,tertiary,doc,1
Banking,General,URLs,URL,Infinite Banking Concept Explained: How to Become Your Own Banker,bankingtruths.com,https://bankingtruths.com/infinite-banking-concept-explained/,,,tertiary,doc,1
Estate,Planning,URLs,URL,"The Four Categories of Estate Planning Firms, Part Two",beachcitiesestatelaw.com,https://beachcitiesestatelaw.com/four-categories-of-estate-planning-firms-part-two/,,,tertiary,doc,1
Estate,Planning,URLs,URL,The Administration of a Probate Estate: A Beginner's Guide,blogs.loc.gov,https://blogs.loc.gov/law/2017/03/the-administration-of-a-probate-estate-a-beginners-guide/,,,tertiary,doc,1
Professional,Career,URLs,URL,Health professionals’ perceptions of planned home birth care within the Brazilian health system,bmcpregnancychildbirth.biomedcentral.com,https://bmcpregnancychildbirth.biomedcentral.com/articles/10.1186/s12884-023-06161-9,,,tertiary,doc,1
Markets,Investing,URLs,URL,Staples of Private Equity: Dividend Recapitalization – BSIC,bsic.it,https://bsic.it/staples-of-private-equity-dividend-recapitalization/,,,tertiary,doc,1
Wealth,Management,URLs,URL,Wealth Manager Job Description Template | LinkedIn Talent Solutions,business.linkedin.com,https://business.linkedin.com/en-in/talent-solutions/resources/talent-acquisition/job-descriptions/wealth-manager,,,tertiary,doc,1
Compliance,Risk,URLs,URL,Should You Become an Auditor? - Purdue Business,business.purdue.edu,https://business.purdue.edu/graduate-programs/blog/posts/should-you-become-an-auditor.php,,,tertiary,doc,1
General,Uncategorized,URLs,URL PDF,Succession and corporate performance: the appropriate successor in family firms,businessperspectives.org,https://businessperspectives.org/images/pdf/applications/publishing/templates/article/assets/9938/imfi_2018_01_Chiang.pdf,,,tertiary,doc,1
Wealth,Planning,URLs,URL,Role of External Advisors in Succession Planning - Andersen,ca.andersen.com,https://ca.andersen.com/blog/role-of-external-advisors-in-succession-planning-the-benefits-of-involving-external-advisors-in-the-succession-planning-process/,,,tertiary,doc,1
Estate,Planning,URLs,URL,"Season 5, Episode 8: How to Prepare for the 2025 CSB Legal ...",calawyers.org,https://calawyers.org/trusts-and-estates/season-5-episode-8-how-to-prepare-for-the-2025-csb-legal-specialization-examination-in-estate-planning-trusts-probate-law/,,,tertiary,doc,1
Credit,Consumer,URLs,URL,How Factoring Provides Working Capital with No Added Debt,capflowfunding.com,https://capflowfunding.com/how-factoring-provides-working-capital-with-no-added-debt/,,,tertiary,doc,1
Tax,General,URLs,URL,"Head of Compliance, Policy & Regulatory Affairs - Peloton Careers",careers.onepeloton.com,https://careers.onepeloton.com/en/all-jobs/7290828/head-of-compliance-policy-regulatory-affairs/,,,secondary,doc,1
Credit,Consumer,URLs,URL,The Certified Credit and Financial Health Counselor course ... - Ed2Go,careertraining.ed2go.com,https://careertraining.ed2go.com/slcc/training-programs/certified-credit-financial-health-counselor/,,,tertiary,doc,1
Technology,FinTech,URLs,URL,The dividend recapitalization process for fund managers - Carta,carta.com,https://carta.com/learn/private-funds/management/dividend-recapitalization/,,,tertiary,doc,1
Markets,Investing,URLs,URL,Private Equity Fund Structure: Diagram & How to Structure a PE Fund,carta.com,https://carta.com/learn/private-funds/private-equity/pe-fund-structures/,,,tertiary,doc,1
Tax,General,URLs,URL,Preventive Maintenance for Mortgage Loans of Low-Income Borrowers,ccsenet.org,https://ccsenet.org/journal/index.php/ijef/article/download/0/0/46742/49949,,,secondary,doc,1
Wealth,Planning,URLs,URL,Professional M&A Advisory Services | Centri,centriconsulting.com,https://centriconsulting.com/services/mergers-acquisitions/,,,tertiary,doc,1
Banking,General,URLs,URL,Alternatives to the Credit Union System – Just a Member - Chip Filson,chipfilson.com,https://chipfilson.com/2024/05/alternatives-to-the-credit-union-system/,,,tertiary,doc,1
Estate,Planning,URLs,URL PDF,"Trusts Law Text and Materials, Fourth edition",cmls-global.com,https://cmls-global.com/wp-content/uploads/2018/03/Trusts-Law.pdf,,,tertiary,doc,1
Compliance,Risk,URLs,URL,Understanding Different Types of Audits | Coconote,coconote.app,https://coconote.app/notes/c008d51a-07c1-430c-b08f-f5be1cb1f76e,,,tertiary,doc,1
Banking,General,URLs,URL,Commercial Banking & Credit Analyst (CBCA®) Certification,corporatefinanceinstitute.com,https://corporatefinanceinstitute.com/certifications/commercial-banking-credit-analyst-certification-cbca/,,,tertiary,doc,1
Professional,Career,URLs,URL,Institutional Asset Management Career Profile,corporatefinanceinstitute.com,https://corporatefinanceinstitute.com/resources/career/institutional/,,,tertiary,doc,1
Professional,Career,URLs,URL,"Middle Office - Overview, History, Staff Roles and Qualifications",corporatefinanceinstitute.com,https://corporatefinanceinstitute.com/resources/career/middle-office/,,,tertiary,doc,1
Professional,Career,URLs,URL,4 Types of Financial Analysts: Which Career Path Fits You Best?,corporatefinanceinstitute.com,https://corporatefinanceinstitute.com/resources/career/types-of-financial-analysts-careers/,,,tertiary,doc,1
Wealth,Management,URLs,URL,Building the Executive Team of a Family Office,cowenpartners.com,https://cowenpartners.com/building-the-executive-team-of-a-family-office/,,,tertiary,doc,1
Wealth,Management,URLs,URL,Evaluating Wealth Management Firms Using Grey Relational Analysis: A Comparative Study,csdb.sciforce.org,https://csdb.sciforce.org/CSDB/article/view/243,,,tertiary,doc,1
Tax,General,URLs,URL,International Taxation Certificate | Georgetown Law,curriculum.law.georgetown.edu,https://curriculum.law.georgetown.edu/llm/llm-certificate-programs/llm-international-taxation-certificate/,,,secondary,doc,1
Technology,FinTech,URLs,URL,Securing financial services: A focus on cybersecurity,cybersecurityguide.org,https://cybersecurityguide.org/industries/financial/,,,tertiary,doc,1
General,Uncategorized,URLs,URL,Shop All - Study Materials | Dalton Education,dalton-education.com,https://dalton-education.com/study-materials,,,tertiary,doc,1
Banking,General,URLs,URL,The Influence of Motivation and Situational Leadership Style on the Performance of Priority Relationship Managers in the Wealth Management Division of Bank ABC,devotion.greenvest.co.id,https://devotion.greenvest.co.id/index.php/dev/article/view/25506,,,tertiary,doc,1
General,Uncategorized,URLs,URL,"Financial capability: a systematic conceptual review, extension and synthesis",digitalcommons.uri.edu,https://digitalcommons.uri.edu/cgi/viewcontent.cgi?article=1236&context=hdf_facpubs,,,tertiary,doc,1
General,Uncategorized,URLs,URL,A Research on the Effects of Nonfamily Manager Involvement on ESG Performance,drpress.org,https://drpress.org/ojs/index.php/fbem/article/view/31293,,,tertiary,doc,1
General,Uncategorized,URLs,URL,E-learning Teaching Materials: Accounting Information Systems,e-jabt.org,https://e-jabt.org/index.php/JABT/article/download/133/112,,,tertiary,doc,1
Tax,General,URLs,URL,THE ADVANTAGE OF CUSTOMER RELATIONSHIP MANAGEMENT IN INCREASING A COMPANY'S INCOME AND REDUCING EXPENDITURES,e-journals.dinamika.ac.id,https://e-journals.dinamika.ac.id/jamb/article/download/246/172,,,secondary,doc,1
Banking,General,URLs,URL,SECURITY OF DIGITAL PAYMENT SERVICES IN THE BANKING SECTOR: CHALLENGES AND WAYS FOR IMPROVEMENT,economicspace.pgasa.dp.ua,http://economicspace.pgasa.dp.ua/article/view/345578,,,tertiary,doc,1
Markets,Investing,URLs,URL,"INVESTMENT FUNDS AND THEIR ROLE IN THE STOCK MARKET: ETF, MUTUAL FUNDS, HEDGE FUNDS",efm.vsau.org,http://efm.vsau.org/en/particles/investment-funds-and-their-role-in-the-stock-market-etf-mutual-funds-hedge-funds,,,tertiary,doc,1
Wealth,Planning,URLs,URL,What is Financial Psychology and Why is it Useful for Advisors?,emoneyadvisor.com,https://emoneyadvisor.com/blog/what-is-financial-psychology-and-how-can-financial-advisors-use-it/,,,tertiary,doc,1
General,Uncategorized,URLs,URL,Financial analyst - Wikipedia,en.wikipedia.org,https://en.wikipedia.org/wiki/Financial_analyst,,,tertiary,doc,1
Markets,Investing,URLs,URL,Real Estate Asset Management: An Accredited Investor's Guide,equitymultiple.com,https://equitymultiple.com/blog/real-estate-asset-management,,,tertiary,doc,1
Compliance,Risk,URLs,URL PDF,"AUDITOR INDEPENDENCE, DISMISSAL THREATS, AND THE MARKET REACTION TO AUDITOR SWITCHES",escholarship.org,https://escholarship.org/content/qt0281w33h/qt0281w33h.pdf?t=oh3gqp,,,tertiary,doc,1
General,Uncategorized,URLs,URL,FAR Becker Supplemental Course - Farhat Lectures,farhatlectures.com,https://farhatlectures.com/courses/far-becker-supplemental-course-2024/,,,tertiary,doc,1
Compliance,General,URLs,URL,How Forensic Accountants Assist in Divorce & Family Law Cases,federal-lawyer.com,https://federal-lawyer.com/corporate-compliance/forensic-accounting/divorce-family-law/,,,tertiary,doc,1
Compliance,General,URLs,URL PDF,[PDF] The Combined Role of General Counsel and the Chief Compliance ...,files.klgates.com,https://files.klgates.com/files/publication/198e978e-6a94-4b7a-bbfa-c0dfc756c079/presentation/publicationattachment/2e53ed98-956a-4bc4-a4f0-7e1a19a84351/the_combined_role_of_gc_and_cco.pdf,,,tertiary,doc,1
Markets,Private,URLs,URL,Key Roles in a Hedge Fund - Finance Unlocked,financeunlocked.com,https://financeunlocked.com/videos/who-works-in-a-hedge-fund,,,tertiary,doc,1
Wealth,Planning,URLs,URL,Books and Materials | Financial Planning CFP Course | BU,financialplanningonline.bu.edu,https://financialplanningonline.bu.edu/curriculum/books-and-materials/,,,tertiary,doc,1
General,Uncategorized,URLs,URL,The Role of a Forensic Accountant in a Divorce,gbfamilylaw.com,https://gbfamilylaw.com/blogs/the-role-of-a-forensic-accountant-in-a-divorce/,,,tertiary,doc,1
Markets,Investing,URLs,URL PDF,[PDF] The changing role of the chief investment officer - Plante Moran,go.plantemoran.com,https://go.plantemoran.com/rs/946-CTY-601/images/PM_Family_Office_CIO.pdf,,,tertiary,doc,1
Markets,Investing,URLs,URL,How Infinite Banking With Whole Life Insurance Can Supercharge ...,goodegginvestments.com,https://goodegginvestments.com/blog/infinite-banking-whole-life-insurance/,,,tertiary,doc,1
Tax,General,URLs,URL,What Does a Regulatory Specialist Do? Role and Responsibilities,graduate.northeastern.edu,https://graduate.northeastern.edu/knowledge-hub/what-does-a-regulatory-affairs-specialist-do/,,,secondary,doc,1
Technology,FinTech,URLs,URL,Cybersecurity strategies in fintech: safeguarding financial data and assets,gsconlinepress.com,https://gsconlinepress.com/journals/gscarr/node/2668,,,tertiary,doc,1
Estate,Planning,URLs,URL,Real Estate Asset Management - Hilco Global,hilcoglobal.com,https://hilcoglobal.com/services/real-estate-asset-management/,,,tertiary,doc,1
Retirement,Planning,URLs,URL PDF,[PDF] Retirement Resource Guide,hr.ncsu.edu,https://hr.ncsu.edu/wp-content/uploads/2024/08/ComPysch-Retirement-Planning-Guide.pdf,,,tertiary,doc,1
Compliance,General,URLs,URL PDF,Competency of Professional Accountant in Malaysia as Attributes towards Compliance of AMLA 2001,hrmars.com,https://hrmars.com/papers_submitted/11180/competency-of-professional-accountant-in-malaysia-as-attributes-towards-compliance-of-amla-2001.pdf,,,tertiary,doc,1
Compliance,General,URLs,URL PDF,AMLA Regime Compliance and Confidentiality of Client Information,hrmars.com,https://hrmars.com/papers_submitted/15079/amla-regime-compliance-and-confidentiality-of-client-information.pdf,,,tertiary,doc,1
Technology,FinTech,URLs,URL,Addressing Cybersecurity Challenges in 5G-enabled IoT and Critical Infrastructures: A Comprehensive Overview,ieeexplore.ieee.org,https://ieeexplore.ieee.org/document/10297774/,,,tertiary,doc,1
Technology,FinTech,URLs,URL,An Innovative Design for Improving U.S. Airports’ Cybersecurity Based on Blockchain Technology,ieeexplore.ieee.org,https://ieeexplore.ieee.org/document/10534684/,,,tertiary,doc,1
Compliance,General,URLs,URL,The Use of Artificial Intelligence in Anti-Money Laundering (AML),ieeexplore.ieee.org,https://ieeexplore.ieee.org/document/10601471/,,,tertiary,doc,1
General,Uncategorized,URLs,URL,Grade-Level Classification of Uzbek Literary Texts Using Text Complexity Features (Grades 5-9),ieeexplore.ieee.org,https://ieeexplore.ieee.org/document/11289265/,,,tertiary,doc,1
General,Uncategorized,URLs,URL,The Use of Financial Technology and Artificial Intelligence in International Economic Relations in the Arab Gulf Region and cyber resilience,ieeexplore.ieee.org,https://ieeexplore.ieee.org/document/11292494/,,,tertiary,doc,1
General,Uncategorized,URLs,URL,DIFFERENT BRANCHES OF GLOBAL ACCOUNTING AND ACCOUNTANTS RESPONSIBILITIES: A STUDY IN BRIEF SPECTRUM,ijabs.ub.ac.id,https://ijabs.ub.ac.id/index.php/ijabs/article/download/364/pdf,,,tertiary,doc,1
General,Uncategorized,URLs,URL PDF,Managing Service Quality And Efficiency In Call Centers: A Tautology Or Contradiction?,ijbms.net,https://ijbms.net/assets/files/1671066409.pdf,,,tertiary,doc,1
Compliance,General,URLs,URL,AI-Driven Data Governance for AML/KYC in Credit Card Issuance: A Framework to Reduce Regulatory Consent Orders,ijcesen.com,https://ijcesen.com/index.php/ijcesen/article/view/3757,,,tertiary,doc,1
Technology,FinTech,URLs,URL PDF,Securing financial data storage: A review of cybersecurity challenges and solutions,ijsra.net,https://ijsra.net/sites/default/files/IJSRA-2024-0267.pdf,,,tertiary,doc,1
Technology,FinTech,URLs,URL PDF,A critical review of emerging cybersecurity threats in financial technologies,ijsra.net,https://ijsra.net/sites/default/files/IJSRA-2024-0284.pdf,,,tertiary,doc,1
Credentials,Professional,URLs,URL,Best CFA Books: Official CFA Institute Books & Top Study Guides,imarticus.org,https://imarticus.org/blog/cfa-books/,,,tertiary,doc,1
Markets,Private,URLs,URL,Careers Working with Hedge Funds - New York Institute of Finance,info.nyif.com,https://info.nyif.com/careers-working-with-hedge-funds/,,,tertiary,doc,1
General,Uncategorized,URLs,URL,BI Reporting - Business Intelligence - insightsoftware,insightsoftware.com,https://insightsoftware.com/encyclopedia/reporting-bi/,,,tertiary,doc,1
Markets,Investing,URLs,URL,Empirical Investigation on Public Perception and Trust in Anti-Money Laundering and KYC Compliance in India’s Banking Sector,inspirajournals.com,https://inspirajournals.com/home/viewdetails/?id=7622,,,tertiary,doc,1
Markets,Investing,URLs,URL,How to Compare Top Financial Advisor Certifications,investmentsandwealth.org,https://investmentsandwealth.org/certifications/compare-financial-advisor-certifications,,,tertiary,doc,1
General,Uncategorized,URLs,Journal article,Understanding treasury management: a comprehensive guide,iongroup.com,https://iongroup.com/blog/treasury/understanding-treasury-management-a-comprehensive-guide/,,,tertiary,doc,1
Wealth,Management,URLs,URL,Family wealth governance: the importance of the family mission ...,iqeq.com,https://iqeq.com/insights/family-wealth-governance-the-importance-of-the-family-mission-statement/,,,tertiary,doc,1
Wealth,Management,URLs,URL,Sovereign Wealth Funds - IQ-EQ,iqeq.com,https://iqeq.com/services/sovereign-wealth-funds/,,,tertiary,doc,1
Credentials,Professional,URLs,URL,Mastering the Series 7: A Comprehensive Guide to Licensing,ironclad.law,https://ironclad.law/series-7-license/,,,tertiary,doc,1
General,Uncategorized,URLs,URL,Estimating the Life Expectancy of Individuals is an Underwriting ...,iscservices.com,https://iscservices.com/estimating-life-expectancy-underwriting-exercise/,,,tertiary,doc,1
Banking,General,URLs,URL,A Study on Customer Satisfaction on E-Banking Services,isjem.com,https://isjem.com/download/a-study-on-customer-satisfaction-on-e-banking-services/,,,tertiary,doc,1
Compliance,General,URLs,URL,"Regulatory Compliance Counsel fo Firms | Jacko Law Group, PC",jackolg.com,https://jackolg.com/regulatory-compliance-counsel/,,,tertiary,doc,1
General,Uncategorized,URLs,URL,Responding to a new generation of proprietary study resources in medical education,jmla.pitt.edu,https://jmla.pitt.edu/ojs/jmla/article/download/619/816,,,tertiary,doc,1
Estate,Planning,URLs,URL,"The 3 Types Of ""Estate"" Attorneys, And Finding The Right Attorney ...",jmslawltd.com,https://jmslawltd.com/the-3-types-of-estate-attorneys-and-finding-the-right-attorney-for-your-needs/,,,tertiary,doc,1
Professional,Career,URLs,URL,Customer service jobs at Fidelity,jobs.fidelity.com,https://jobs.fidelity.com/en/teams/customer-service/,,,tertiary,doc,1
