domain,subdomain,category,resource_type,title,organization,url,jurisdiction,notes,authority_tier,source,contexts_count
Data,Labor,URLs,URL,Financial Analysts : Occupational Outlook Handbook,www.bls.gov,https://www.bls.gov/ooh/business-and-financial/financial-analysts.htm,,,primary,doc,1
Wealth,Management,URLs,URL,Generational Wealth Planning Tips | Family Office - BPM,www.bpm.com,https://www.bpm.com/insights/generational-wealth-planning/,,,tertiary,doc,1
Markets,Investing,URLs,URL,Top roles in Hedge Fund Management | Bright Network,www.brightnetwork.co.uk,https://www.brightnetwork.co.uk/career-path-guides/investment-banking/roles-in-hedge-fund-management/,,,tertiary,doc,1
Tax,General,URLs,URL,Should I Raise My First Round of Funding Via Convertible Debt or ...,www.cairncross.com,https://www.cairncross.com/blog/ch-news/should-i-raise-my-first-round-of-funding-via-convertible-debt-or-equity/,,,secondary,doc,1
Tax,State,URLs,URL PDF,[PDF] 2023 Legal Specialist Examination Preparation Packet,www.calbar.ca.gov,https://www.calbar.ca.gov/Portals/0/documents/ls/LS_Ed/LS_Examination/LS_Exam_Prep/LS_Exam_Prep_Estate.pdf,,,primary,doc,1
Tax,State,URLs,URL PDF,"[PDF] Estate Planning, Trust & Probate Law Exam Scope and Sample ...",www.calbar.ca.gov,https://www.calbar.ca.gov/sites/default/files/portals/0/documents/ls/Estate-Planning-Trust-Probate-Law-Exam-Scope-and-Sample-Questions.pdf,,,primary,doc,1
Retirement,State,URLs,URL,Service & Disability Retirement - CalPERS,www.calpers.ca.gov,https://www.calpers.ca.gov/members/retirement-benefits/service-disability-retirement,,,primary,doc,1
Research,Academic,URLs,Journal article,ERISA and the Failure of Employers to Perform Their Fiduciary Duties: Evidence from a Survey of Health Plan Administrators.,www.cambridge.org,https://www.cambridge.org/core/product/identifier/S1073110525101599/type/journal_article,,,secondary,doc,1
Tax,General,URLs,URL,International Tax Attorneys | Caplin & Drysdale,www.caplindrysdale.com,https://www.caplindrysdale.com/practices-international_tax,,,secondary,doc,1
Professional,Career,URLs,URL,What does an institutional asset manager do? - CareerExplorer,www.careerexplorer.com,https://www.careerexplorer.com/careers/institutional-asset-manager/,,,tertiary,doc,1
Compliance,General,URLs,URL,What does a regulatory compliance officer do? - CareerExplorer,www.careerexplorer.com,https://www.careerexplorer.com/careers/regulatory-compliance-officer/,,,tertiary,doc,1
Legal,Tax,URLs,URL,International Tax - Carlton Fields,www.carltonfields.com,https://www.carltonfields.com/services/tax/international-tax,,,tertiary,doc,1
Wealth,Management,URLs,URL,Designations for Financial Advisors: A Complete Guide,www.carsonwealth.com,https://www.carsonwealth.com/insights/blog/what-do-financial-adviser-designations-mean-what-are-the-letters-after-a-name/,,,tertiary,doc,1
Credentials,Investing,URLs,URL,"CFA eBooks - 2026 CFA Level 1, 2 & 3 Study Materials",www.cfaebooks.com,https://www.cfaebooks.com,,,tertiary,doc,1
Credentials,Investing,URLs,URL,Portfolio Management for Institutional Investors | CFA Institute,www.cfainstitute.org,https://www.cfainstitute.org/insights/professional-learning/refresher-readings/2026/portfolio-management-institutional-investors,,,secondary,doc,1
Credentials,Investing,URLs,URL,What are Financial Research Analysts? | CFA Institute,www.cfainstitute.org,https://www.cfainstitute.org/programs/cfa-program/careers/research-analyst,,,secondary,doc,1
General,Uncategorized,URLs,URL,A Glossary of Key Finance Team Roles & Responsibilities,www.cfoconnect.eu,https://www.cfoconnect.eu/en/resources/finance-insights/key-finance-team-roles-responsibilities/,,,tertiary,doc,1
Credentials,Wealth,URLs,URL,CFP Education Requirements & Coursework - CFP Board,www.cfp.net,https://www.cfp.net/certification-process/education-requirement,,,secondary,doc,1
Credentials,Wealth,URLs,URL,What You'll Learn through the Coursework Requirement - CFP Board,www.cfp.net,https://www.cfp.net/certification-process/education-requirement/certification-coursework-requirement/what-youll-learn,,,secondary,doc,1
Credentials,Wealth,URLs,URL,CFP® Exam Preparation,www.cfp.net,https://www.cfp.net/certification-process/exam-requirement/cfp-exam-preparation,,,secondary,doc,1
Credentials,Wealth,URLs,URL,Exam Prep Resources - CFP Board,www.cfp.net,https://www.cfp.net/certification-process/exam-requirement/cfp-exam-preparation/exam-prep-resources,,,secondary,doc,1
Banking,General,URLs,URL,Property Management vs. Asset Management in Commercial Real ...,www.commercialrealestate.loans,https://www.commercialrealestate.loans/commercial-real-estate-glossary/property-management-vs-asset-management/,,,tertiary,doc,1
Wealth,Management,URLs,URL,A Philanthropic Advisor Can Be a Powerful Ally | Congruent Wealth,www.congruentwealth.com,https://www.congruentwealth.com/blog/a-philanthropic-advisor-can-be-a-powerful-ally,,,tertiary,doc,1
Compliance,General,URLs,URL,The Roles of General Counsel and Chief Compliance Officers,www.corporatecomplianceinsights.com,https://www.corporatecomplianceinsights.com/the-roles-of-general-counsel-and-chief-compliance-officers/,,,tertiary,doc,1
Standards,Risk,URLs,URL,Enterprise Risk Management - COSO.org,www.coso.org,https://www.coso.org/guidance-erm,,,secondary,doc,1
Credentials,Education,URLs,Course,What Is Business Intelligence Reporting? | Coursera,www.coursera.org,https://www.coursera.org/articles/business-intelligence-reporting,,,tertiary,doc,1
Banking,General,URLs,URL,Corporate Lending Relationship Manager,www.csi.ca,https://www.csi.ca/en/explore/career-map/corporate-lending-relationship-manager,,,tertiary,doc,1
Estate,Elder Law,URLs,URL,"Elder Law, Elder-Care, Medi-Cal Planning - CunninghamLegal",www.cunninghamlegal.com,https://www.cunninghamlegal.com/california-legal-services/elder-law/,,,tertiary,doc,1
Technology,Security,URLs,URL,Understanding the different types of audits: A guide - CyberArrow,www.cyberarrow.io,https://www.cyberarrow.io/blog/types-of-audits/,,,tertiary,doc,1
Technology,Security,URLs,URL,Cybersecurity for financial services: Definitions & Examples | Darktrace,www.darktrace.com,https://www.darktrace.com/cyber-ai-glossary/cybersecurity-for-financial-services,,,tertiary,doc,1
Banking,Credit Unions,URLs,URL,Advocacy in Action: Banks Selling to Credit Unions: A Win for Local ...,www.dcuc.org,https://www.dcuc.org/news/advocacy-in-action-banks-selling-to-credit-unions-a-win-for-local-communities,,,secondary,doc,1
Credit,Consumer,URLs,URL,Cash Management vs. Treasury Management Explained - DebtBook,www.debtbook.com,https://www.debtbook.com/blog/cash-management-vs-treasury-management-explained,,,tertiary,doc,1
Legal,Securities,URLs,URL,Securities Law - Duane Morris LLP,www.duanemorris.com,https://www.duanemorris.com/practices/securitieslaw.html,,,tertiary,doc,1
Legal,Securities,URLs,URL PDF,[PDF] Introduction to Fund Formation - Duane Morris,www.duanemorris.com,https://www.duanemorris.com/site/static/introduction_to_fund_formation.pdf,,,tertiary,doc,1
Legal,Securities,URLs,URL PDF,[PDF] Private Equity Fund Distribution Waterfalls - Duane Morris,www.duanemorris.com,https://www.duanemorris.com/site/static/private_equity_fund_distribution_waterfalls.pdf,,,tertiary,doc,1
Estate,Elder Law,URLs,URL,The Role of an Elder Law Attorney in Medicaid Planning,www.elderlawanswers.com,https://www.elderlawanswers.com/the-attorneys-role-in-medicaid-planning-12260,,,secondary,doc,1
Research,Academic,URLs,URL,Investment efficiency of targeted S-curve industries: the roles of CEO duality and financial reporting quality,www.emerald.com,http://www.emerald.com/jabs/article/18/3/565-592/1221449,,,secondary,doc,1
Research,Academic,URLs,URL,The chief project officer: a new executive role for turbulent times,www.emerald.com,http://www.emerald.com/jbs/article/42/4/249-256/224552,,,secondary,doc,1
Research,Academic,URLs,URL,Chief executive officer ability and cash holding decision,www.emerald.com,http://www.emerald.com/raf/article/21/5/449-485/360123,,,secondary,doc,1
Research,Academic,URLs,URL,The adoption of governance mechanisms in family businesses: an institutional lens,www.emerald.com,https://www.emerald.com/insight/content/doi/10.1108/JFBM-07-2019-0054/full/pdf?title=the-adoption-of-governance-mechanisms-in-family-businesses-an-institutional-lens,,,secondary,doc,1
Research,Academic,URLs,URL,A theory of venture capital family business: a governance trajectory,www.emerald.com,https://www.emerald.com/insight/content/doi/10.1108/JFBM-08-2021-0096/full/pdf?title=a-theory-of-venture-capital-family-business-a-governance-trajectory,,,secondary,doc,1
Estate,Planning,URLs,Journal article,Understanding the Role of a Trust Protector in Modern Trusts | Equiom,www.equiomgroup.com,https://www.equiomgroup.com/news/understanding-role-trust-protector-modern-trusts,,,tertiary,doc,1
Estate,Planning,URLs,URL,Elder Law and Medi-Cal Planning: Securing Your Future in California,www.estateandtrustlawyer.com,https://www.estateandtrustlawyer.com/elder-law-and-medi-cal-planning-securing-your-future-in-california/,,,tertiary,doc,1
Estate,Planning,URLs,URL,"Elder Law & Medi-Cal Attorney In Monterey, California",www.estateplan-lawyers.com,https://www.estateplan-lawyers.com/services/elder-law-medical-services,,,tertiary,doc,1
Insurance,General,URLs,URL,Life and Health Insurance Prelicensing - ExamFX,www.examfx.com,https://www.examfx.com/insurance/life-health,,,tertiary,doc,1
Credit,Consumer,URLs,URL,Loan Officer vs. Mortgage Broker vs. Mortgage Lender - Experian,www.experian.com,https://www.experian.com/blogs/ask-experian/loan-officer-vs-mortgage-broker-vs-mortgage-lender/,,,secondary,doc,1
Credit,Consumer,URLs,URL,Adding tradelines to build credit for your business - Experian,www.experian.com,https://www.experian.com/blogs/small-business-matters/2021/05/10/adding-tradelines-to-build-credit-for-your-business/,,,secondary,doc,1
General,Uncategorized,URLs,URL,Personal Property Appraiser Expert Witnesses in California,www.expertinstitute.com,https://www.expertinstitute.com/expert-witness/personal-property-appraiser/california/,,,tertiary,doc,1
Business,Consulting,URLs,URL,Startup valuation: applying the discounted cash flow method in six ...,www.ey.com,https://www.ey.com/en_nl/services/finance-navigator/startup-valuation-applying-the-discounted-cash-flow-method-in-six-easy-step,,,tertiary,doc,1
Banking,Federal,URLs,Regulator guidance,Information Technology (IT) and Cybersecurity | FDIC.gov,www.fdic.gov,https://www.fdic.gov/banker-resource-center/information-technology-it-and-cybersecurity,,,primary,doc,1
Markets,Investing,URLs,URL,"Financial Services Industry: Front, Middle and Back Office",www.fe.training,https://www.fe.training/free-resources/investment-banking/financial-services-industry-front-middle-and-back-office/,,,tertiary,doc,1
Markets,Investing,URLs,URL,Convertible Venture Debt - Financial Edge,www.fe.training,https://www.fe.training/free-resources/private-equity/convertible-venture-debt/,,,tertiary,doc,1
Markets,Private,URLs,URL,Venture Capital Analyst - Career Path - Financial Edge,www.fe.training,https://www.fe.training/free-resources/venture-capital/what-is-a-venture-capital-analyst/,,,tertiary,doc,1
Banking,Federal,URLs,Regulator guidance PDF,Does corporate lending by banks and finance companies differ? Evidence on specialization in private debt contracting,www.federalreserve.gov,https://www.federalreserve.gov/pubs/feds/1996/199625/199625pap.pdf,,,primary,doc,1
Wealth,Planning,URLs,URL,Fidelity Philanthropic Consulting | Advisors to guide your ...,www.fidelity.com,https://www.fidelity.com/go/philanthropic-consulting,,,tertiary,doc,1
Markets,Investing,URLs,URL,"Investment Management, Financial & Generational Wealth Planning",www.fiducientadvisors.com,https://www.fiducientadvisors.com/expertise/private-wealth-advisor,,,tertiary,doc,1
Credit,Consumer,URLs,URL,How to Become a Credit Counselor: Best Pathway | NFEC,www.financialeducatorscouncil.org,https://www.financialeducatorscouncil.org/how-to-become-a-credit-counselor/,,,tertiary,doc,1
Markets,Federal,URLs,URL,Chartered Financial Consultant (ChFC) - FINRA,www.finra.org,https://www.finra.org/investors/professional-designations/chfc,,,primary,doc,1
Markets,Federal,URLs,URL,Series 7 – General Securities Representative Exam | FINRA.org,www.finra.org,https://www.finra.org/registration-exams-ce/qualification-exams/series7,,,primary,doc,1
Technology,FinTech,URLs,URL,Innovative Pricing Strategies for Fintech Products,www.fintechweekly.com,https://www.fintechweekly.com/magazine/articles/innovative-pricing-strategies-for-fintech-products,,,tertiary,doc,1
Markets,Investing,URLs,URL,"Equity, Venture Debt, or Convertible Note? - Flow Capital",www.flowcap.com,https://www.flowcap.com/resources/raising-capital-for-startups-equity-venture-debt-or-convertible-note,,,tertiary,doc,1
Business,Media,URLs,URL,Spotlight: The Role Of Family Office Investment Committees - Forbes,www.forbes.com,https://www.forbes.com/sites/paulwestall/2025/07/24/spotlight-the-role-of-family-office-investment-committees/,,,tertiary,doc,1
General,Uncategorized,URLs,URL,Top 15 financial modeling techniques for business clarity - Forecastr,www.forecastr.co,https://www.forecastr.co/blog/financial-modeling-tips,,,tertiary,doc,1
Wealth,Planning,URLs,URL,Understanding The Different Types of Financial Advisors,www.fortpittcapital.com,https://www.fortpittcapital.com/blog/understanding-the-different-types-of-financial-advisors/,,,tertiary,doc,1
Legal,Wealth,URLs,URL,International Taxation & Wealth Planning - Fox Rothschild LLP,www.foxrothschild.com,https://www.foxrothschild.com/international-taxation-wealth-planning/international-wealth-planning,,,tertiary,doc,1
Business,Consulting,URLs,URL,FranklinCovey Executive Coaching,www.franklincovey.com,https://www.franklincovey.com/coaching/executive-coaching/,,,tertiary,doc,1
Research,Academic,URLs,URL,The relationship between future self-continuity and intention to use Internet wealth management: The mediating role of tolerance of uncertainty and trait anxiety,www.frontiersin.org,https://www.frontiersin.org/articles/10.3389/fpsyg.2022.939508/full,,,secondary,doc,1
Estate,Planning,URLs,URL,"The role of Trust Protectors, Trust Advisers, and Special Fiduciaries",www.gmdlegal.com,https://www.gmdlegal.com/trust-protectors-trust-advisers-and-special-fiduciaries/,,,tertiary,doc,1
General,Uncategorized,URLs,URL,The Ultimate Guide to Cash Management - Types & Strategies,www.highradius.com,https://www.highradius.com/resources/Blog/cash-management-guide/,,,tertiary,doc,1
General,Uncategorized,URLs,URL,Proactive Finance Department Structure: The Ultimate Guide,www.highradius.com,https://www.highradius.com/resources/Blog/finance-team-structure/,,,tertiary,doc,1
Legal,General,URLs,URL,Common Trust and Estate Fiduciary Responsibilities | Insights,www.hklaw.com,https://www.hklaw.com/en/insights/publications/2003/07/common-trust-and-estate-fiduciary-responsibilities,,,tertiary,doc,1
Legal,General,URLs,URL,International Tax | Practices - Holland & Knight,www.hklaw.com,https://www.hklaw.com/en/services/practices/tax-executive-compensation-and-benefits/international-tax,,,tertiary,doc,1
Estate,Planning,URLs,URL,The Role of a Trust Protector In Estate Planning - Holbrook & Manter,www.holbrookmanter.com,https://www.holbrookmanter.com/protect-peace-mind-trust-protector/,,,tertiary,doc,1
Research,Academic,URLs,URL PDF,Integrating Experiential Learning in an Introductory Financial Accounting Course to Enhance Learning: The FIFA Approach,www.hrpub.org,http://www.hrpub.org/download/20201230/UJER7-19517314.pdf,,,tertiary,doc,1
Credentials,Professional,URLs,URL,"Compensation and Benefits Manager Jobs, Salary and Certification",www.humanresourcesedu.org,https://www.humanresourcesedu.org/benefits-specialist/,,,tertiary,doc,1
Technology,Security,URLs,URL PDF,A Review on the Benefits of Continuous Threat Exposure Management in the Banking Industry,www.ic3.gov,https://www.ic3.gov/Media/PDF/AnnualReport/2022_IC3Report.pdf,,,primary,doc,1
Research,Academic,URLs,URL PDF,"Securing the Financial Realm: Unveiling Cybersecurity Threats, Vulnerabilities, and Advanced Security Solutions in Banking",www.ijfmr.com,https://www.ijfmr.com/papers/2023/6/10948.pdf,,,tertiary,doc,1
Research,Academic,URLs,URL PDF,Omnichannel Strategy in Cloud-Based Contact Centers: A Blueprint for Success,www.ijfmr.com,https://www.ijfmr.com/papers/2024/6/30422.pdf,,,tertiary,doc,1
Research,Academic,URLs,URL,Unobserved Performance In Hedge Funds A Hidden Dimension Of Investment,www.ijfmr.com,https://www.ijfmr.com/research-paper.php?id=43937,,,tertiary,doc,1
Research,Academic,URLs,URL,From Horsepower to Hedge Funds: Parallels Between Energy Transitions and Financial Market Innovations,www.ijfmr.com,https://www.ijfmr.com/research-paper.php?id=58780,,,tertiary,doc,1
Banking,General,URLs,URL,Commercial Banks Compliance on the Pillars of Anti-Money Laundering (AML) and Their Know Your Customer (KYC) Practices Towards Ensuring the Integrity of Financial Transactions,www.ijisrt.com,https://www.ijisrt.com/commercial-banks-compliance-on-the-pillars-of-antimoney-laundering-aml-and-their-know-your-customer-kyc-practices-towards-ensuring-the-integrity-of-financial-transactions,,,tertiary,doc,1
General,Uncategorized,URLs,URL,Enhancing Service Quality through the Integration of Technology in the Department of Labor and Employment in Iligan City,www.ijsat.org,https://www.ijsat.org/research-paper.php?id=4236,,,tertiary,doc,1
Professional,Career,URLs,URL,How to Become a Compensation and Benefits Specialist | Indeed.com,www.indeed.com,https://www.indeed.com/career-advice/finding-a-job/compensation-and-benefits-specialist,,,tertiary,doc,1
Markets,Investing,URLs,URL,Front Office vs. Middle Office vs. Back Office in Investment Banking,www.indeed.com,https://www.indeed.com/career-advice/finding-a-job/front-office-vs-middle-office-vs-back-office-investment-banking,,,tertiary,doc,1
Wealth,Planning,URLs,URL,What Is a Paraplanner and What Do They Do at Work? | Indeed.com,www.indeed.com,https://www.indeed.com/career-advice/finding-a-job/what-is-paraplanner,,,tertiary,doc,1
Estate,Planning,URLs,URL,"Estate Family Office Manager Jobs, Employment in California | Indeed",www.indeed.com,https://www.indeed.com/m/jobs?q=Estate+Family+Office+Manager&l=California,,,tertiary,doc,1
Technology,FinTech,URLs,URL,The Case for a Chief Innovation and Transformation Officer in the Age of AI,www.innovativehumancapital.com,https://www.innovativehumancapital.com/article/the-case-for-a-chief-innovation-and-transformation-officer-in-the-age-of-ai,,,tertiary,doc,1
Credentials,Professional,URLs,URL,Series 7 License: What It Covers and Who Needs It - InnReg,www.innreg.com,https://www.innreg.com/blog/finra-series-7-license,,,tertiary,doc,1
Insurance,General,URLs,URL,Life Agent and Accident and Health or Sickness license Frequently ...,www.insurance.ca.gov,https://www.insurance.ca.gov/0200-industry/0090-faq/lo-ahfaq.cfm,,,tertiary,doc,1
Markets,Investing,URLs,URL,Optimal Use of Financial Leverage in a Corporate Capital Structure,www.investopedia.com,https://www.investopedia.com/articles/investing/111813/optimal-use-financial-leverage-corporate-capital-structure.asp,,,tertiary,doc,1
Markets,Investing,URLs,URL,Financial Analyst vs. Research Analyst: What's the Difference?,www.investopedia.com,https://www.investopedia.com/articles/professionals/092415/career-advice-financial-analyst-vsresearch-analyst.asp,,,tertiary,doc,1
Markets,Investing,URLs,URL,Understanding Actuarial Assumptions and Their Applications,www.investopedia.com,https://www.investopedia.com/terms/a/actuarial-assumption.asp,,,tertiary,doc,1
Markets,Investing,URLs,URL,Paraplanning vs. Financial Planning: Key Differences and Roles ...,www.investopedia.com,https://www.investopedia.com/terms/p/paraplanning.asp,,,tertiary,doc,1
Markets,Investing,URLs,URL,Key Roles of Relationship Managers: Types and Essential Skills,www.investopedia.com,https://www.investopedia.com/terms/r/relationship-manager.asp,,,tertiary,doc,1
General,Uncategorized,URLs,URL,Protectors of Corporate Integrity: Assessing the Role of Independent Directors in Light of the 2013 Companies Act,www.irejournals.com,https://www.irejournals.com/paper-details/1712208,,,tertiary,doc,1
Technology,FinTech,URLs,URL,Cybersecurity Measures in Financial Institutions Protecting Sensitive Data from Emerging Threats and Vulnerabilities,www.itm-conferences.org,https://www.itm-conferences.org/10.1051/itmconf/20257602002,,,tertiary,doc,1
Tax,General,URLs,URL,International Tax Group - Jeffer Mangels Butler & Mitchell LLP,www.jmbm.com,https://www.jmbm.com/international-tax.html,,,secondary,doc,1
Markets,Investing,URLs,URL,"Private Equity Analyst: Role, Responsibilities, & Salary | Leland",www.joinleland.com,https://www.joinleland.com/library/a/a-day-in-the-life-of-a-private-equity-analyst,,,tertiary,doc,1
Credentials,Professional,URLs,URL,Intro to Financial Modeling – With Examples (2025) - Leland,www.joinleland.com,https://www.joinleland.com/library/a/a-guide-to-financial-modeling-an-overview-of-the-basics,,,tertiary,doc,1
Markets,Private,URLs,URL,Venture Debt: How Venture Debt Financing Works | J.P. Morgan,www.jpmorgan.com,https://www.jpmorgan.com/insights/banking/commercial-banking/venture-debt-how-venture-debt-financing-works,,,tertiary,doc,1
General,Uncategorized,URLs,URL,Business Succession Planning: Building an Effective Team,www.jpmorgan.com,https://www.jpmorgan.com/insights/business-planning/business-succession-planning-building-an-effective-team,,,tertiary,doc,1
Credit,Consumer,URLs,URL,Receivables Financing Solutions | J.P. Morgan,www.jpmorgan.com,https://www.jpmorgan.com/payments/solutions/trade-and-working-capital/receivables-financing,,,tertiary,doc,1
General,Uncategorized,URLs,URL,Statistical Analysis of Financial Data in S-PLUS,www.jstatsoft.org,http://www.jstatsoft.org/v11/b04/,,,tertiary,doc,1
Wealth,Management,URLs,Journal article,Seeking Career Opportunities | Wealth Management,www.judson-group.com,https://www.judson-group.com/talent-wealth-management/,,,tertiary,doc,1
Business,Finance,URLs,URL,California Personal Property Valuation Expert Witnesses,www.jurispro.com,https://www.jurispro.com/category/personal-property-valuation-s-87/CA,,,tertiary,doc,1
Wealth,Planning,URLs,URL,CFP Certification Education Program for CFP Exam,www.kaplanfinancial.com,https://www.kaplanfinancial.com/cfp/education-program,,,tertiary,doc,1
Wealth,Planning,URLs,URL,CFP Free Study Materials | Kaplan Financial Education,www.kaplanfinancial.com,https://www.kaplanfinancial.com/cfp/free-study-materials,,,tertiary,doc,1
Insurance,General,URLs,URL,Free Insurance Exam Study Materials & Guide,www.kaplanfinancial.com,https://www.kaplanfinancial.com/insurance/free-study-materials,,,tertiary,doc,1
Insurance,General,URLs,URL,Popular Careers in the Insurance Industry: What You Can Do with ...,www.kaplanfinancial.com,https://www.kaplanfinancial.com/resources/getting-started/insurance-careers,,,tertiary,doc,1
Credentials,Professional,URLs,URL,Bar Review Courses and Exam Prep - Kaplan Test Prep,www.kaptest.com,https://www.kaptest.com/bar-exam,,,tertiary,doc,1
Credentials,Professional,URLs,URL,Bar Review Course and Bar Exam Practice Questions,www.kaptest.com,https://www.kaptest.com/bar-exam/courses,,,tertiary,doc,1
Estate,Planning,URLs,URL,Best Trusts Books for Estate Planning Experts - Kazi Law Firm,www.kazilawfirm.com,https://www.kazilawfirm.com/best-trusts-books-for-estate-planning-experts/,,,tertiary,doc,1
Tax,General,URLs,URL,ChFC® - Chartered Financial Consultant Category,www.keirsuccess.com,https://www.keirsuccess.com/products/the-american-college/chfc-chartered-financial-consultant,,,secondary,doc,1
General,Uncategorized,URLs,URL,Long Walk to Freedom. The Autobiography of Nelson Mandela.,www.koersjournal.org.za,http://www.koersjournal.org.za/index.php/koers/article/download/652/766,,,tertiary,doc,1
General,Uncategorized,URLs,URL,Succession Planning Services - Korn Ferry,www.kornferry.com,https://www.kornferry.com/capabilities/assessment-succession/succession-planning,,,tertiary,doc,1
Estate,Planning,URLs,URL,fiduciary duties of trustees | Wex - Law.Cornell.Edu,www.law.cornell.edu,https://www.law.cornell.edu/wex/fiduciary_duties_of_trustees,,,tertiary,doc,1
Tax,General,URLs,URL PDF,[PDF] A Compendium of Private Equity Tax Games - NYU Law,www.law.nyu.edu,https://www.law.nyu.edu/sites/default/files/upload_documents/Gregg%20Polsky.pdf,,,secondary,doc,1
Banking,General,URLs,URL,Inside Banking Choices | Lafayette Federal Credit Union,www.lfcu.org,https://www.lfcu.org/news/managing-money-credit/inside-banking-choices-key-differences-between-community-banks-and-credit-unions/,,,tertiary,doc,1
Compliance,Risk,URLs,URL,"Understanding the different types of audits: Financial, Internal ...",www.linkedin.com,https://www.linkedin.com/posts/m-amin-and-co-chartered-accountants_audit-internalaudit-financialaudit-activity-7392175358483226625-FRNG,,,tertiary,doc,1
Markets,Investing,URLs,URL,SEC & Regulatory Enforcement Lawyers - Latham & Watkins LLP,www.lw.com,https://www.lw.com/en/practices/white-collar-defense-and-investigations/sec-and-regulatory-enforcement,,,tertiary,doc,1
Banking,General,URLs,URL,MBA Education Executive Coaching - Mortgage Bankers Association,www.mba.org,https://www.mba.org/conferences-and-education/education-courses/leadership/executive-coaching,,,tertiary,doc,1
General,Uncategorized,URLs,URL,CFO vs. Bookkeeper: Understanding the Distinct Roles - McCracken,www.mccrackenalliance.com,https://www.mccrackenalliance.com/blog/cfo-vs-bookkeeper-understanding-the-distinct-roles,,,tertiary,doc,1
