domain,subdomain,category,resource_type,title,organization,url,jurisdiction,notes,authority_tier,source,contexts_count
Compliance,Risk,URLs,URL,Leverage Ratios: How CFOs Use Debt Metrics to Navigate Risk and ...,www.mccrackenalliance.com,https://www.mccrackenalliance.com/blog/leverage-ratios-how-cfos-use-debt-metrics-to-navigate-risk-and-growth,,,tertiary,doc,1
Business,Consulting,URLs,URL,The new role of cybersecurity in financial services - McKinsey,www.mckinsey.com,https://www.mckinsey.com/capabilities/risk-and-resilience/our-insights/the-cyber-clock-is-ticking-derisking-emerging-technologies-in-financial-services,,,tertiary,doc,1
Markets,Private,URLs,URL,The Performance of Hedge Funds: Are There Differences in Terms of Gender?,www.mdpi.com,https://www.mdpi.com/1911-8074/17/11/499,,,tertiary,doc,1
General,Uncategorized,URLs,URL,"ChatGPT, Help! I Am in Financial Trouble",www.mdpi.com,https://www.mdpi.com/1911-8074/17/6/241/pdf?version=1718098821,,,tertiary,doc,1
General,Uncategorized,URLs,URL,"Shared Identity, Family Influence, and the Transgenerational Intentions in Family Firms",www.mdpi.com,https://www.mdpi.com/2071-1050/11/4/1130/pdf?version=1550734281,,,tertiary,doc,1
General,Uncategorized,URLs,URL,Toward an Understanding of Family Business Sustainability: A Network-Based Systematic Review,www.mdpi.com,https://www.mdpi.com/2071-1050/13/1/5/pdf,,,tertiary,doc,1
General,Uncategorized,URLs,URL,Mapping Financial Literacy: A Systematic Literature Review of Determinants and Recent Trends,www.mdpi.com,https://www.mdpi.com/2071-1050/15/12/9358/pdf?version=1686312400,,,tertiary,doc,1
General,Uncategorized,URLs,URL,Customer Relationship Management and Recent Developments,www.mdpi.com,https://www.mdpi.com/2076-3387/6/3/7/pdf?version=1467356222,,,tertiary,doc,1
General,Uncategorized,URLs,URL,"Economic, Non-Economic and Critical Factors for the Sustainability of Family Firms",www.mdpi.com,https://www.mdpi.com/2199-8531/6/4/119/pdf,,,tertiary,doc,1
Estate,Elder Law,URLs,URL,Elder Law Attorneys & Medicaid Planning,www.medicaidplanningassistance.org,https://www.medicaidplanningassistance.org/elder-law-attorneys/,,,tertiary,doc,1
Wealth,Management,URLs,URL,Generational Wealth Planning - Mercer Advisors,www.merceradvisors.com,https://www.merceradvisors.com/solutions/family-and-health/generational-wealth-planning/,,,tertiary,doc,1
Wealth,Management,URLs,URL,A guide to special needs financial planning | Mesirow,www.mesirow.com,https://www.mesirow.com/wealth-knowledge-center/guide-special-needs-financial-planning,,,tertiary,doc,1
Banking,General,URLs,URL PDF,[PDF] Loan officer guide to working with financial advisors 2021 - MGIC,www.mgic.com,https://www.mgic.com/-/media/loan-officer-hub/downloads/Loan-officer-guide-to-working-with-financial-advisors-2021.pdf,,,tertiary,doc,1
Technology,FinTech,URLs,URL,What Is Financial Therapy? How Can I Become A Financial Therapist?,www.mindmoneybalance.com,https://www.mindmoneybalance.com/blogandvideos/what-is-financial-therapy-become-financial-therapist,,,tertiary,doc,1
Credentials,Professional,URLs,URL,Put A Business Valuation Pro On Your M&A Team - Mjcpa.com,www.mjcpa.com,https://www.mjcpa.com/put-a-business-valuation-pro-on-your-ma-team/,,,tertiary,doc,1
Markets,Investing,URLs,URL,Commercial Real Estate Asset & Portfolio Management - Modern CRE,www.modern-cre.com,https://www.modern-cre.com/commercial-real-estate-services/asset-portfolio-management-strategy,,,tertiary,doc,1
Banking,General,URLs,URL,The Difference: Credit Unions vs. Banks,www.monterra.org,https://www.monterra.org/blog/2023/unveiling-the-distinctions-credit-unions-vs-banks-how-are-they-different,,,tertiary,doc,1
Markets,Investing,URLs,URL,Investment Committees Can Safeguard Family Legacies,www.morganlewis.com,https://www.morganlewis.com/pubs/2024/07/strengthening-governance-in-family-offices-investment-committees-can-safeguard-family-legacies,,,tertiary,doc,1
Business,Consulting,URLs,URL,Client Relations Contact | Morgan Stanley,www.morganstanley.com,https://www.morganstanley.com/wealth-general/client-relations-contact,,,tertiary,doc,1
Credentials,Professional,URLs,URL,Certified Valuation Analyst Credentialing Resources - NACVA,www.nacva.com,https://www.nacva.com/CVACredentialingResources,,,tertiary,doc,1
Credentials,Professional,URLs,URL,Business Valuation Certification and Training Center: Self-Study ...,www.nacva.com,https://www.nacva.com/store_product.asp?prodid=447,,,tertiary,doc,1
Estate,Planning,URLs,URL,Estate Planning Law Specialist Exam Study Materials,www.naepc.org,https://www.naepc.org/designations/estate-law/study-materials,,,tertiary,doc,1
Credit,Consumer,URLs,URL,Business Tradelines: What They Can Do for Your Business Credit,www.nav.com,https://www.nav.com/resource/business-tradelines/,,,tertiary,doc,1
Banking,General,URLs,URL,Business Line of Credit | Navy Federal Credit Union,www.navyfederal.org,https://www.navyfederal.org/services/business/loans/line-of-credit.html,,,tertiary,doc,1
Wealth,Planning,URLs,URL,What Is a Financial Coach and How to Become One - NerdWallet,www.nerdwallet.com,https://www.nerdwallet.com/financial-advisors/learn/financial-coach,,,tertiary,doc,1
Wealth,Planning,URLs,URL,Financial Therapist: What They Do and How to Find One - NerdWallet,www.nerdwallet.com,https://www.nerdwallet.com/financial-advisors/learn/how-financial-therapist-shift-your-money-mindset,,,tertiary,doc,1
Credentials,Professional,URLs,URL,Forensic Accounting and Divorce | Financial Clarity & Asset Protection,www.neumeistercpa.com,https://www.neumeistercpa.com/forensic-accounting-and-divorce/,,,tertiary,doc,1
Estate,Planning,URLs,URL,Philanthropic Consulting | NPTrust,www.nptrust.org,https://www.nptrust.org/philanthropic-consulting/,,,tertiary,doc,1
Estate,Planning,URLs,URL,"Personal Property Appraiser | Sacramento, Napa, Monterey",www.nunneleyestates.com,https://www.nunneleyestates.com/appraisals,,,tertiary,doc,1
Retirement,Planning,URLs,URL PDF,[PDF] The role of actuarial calculations and reviews in pension supervision,www.oecd.org,https://www.oecd.org/content/dam/iops/en/working-papers/WP_24_Background-paper-actuarial-calculations.pdf,,,tertiary,doc,1
Professional,Career,URLs,URL PDF,[PDF] Human Resources Specialist (Employee Benefits) Career Path Guide,www.opm.gov,https://www.opm.gov/policy-data-oversight/training-and-development/career-development/employee-benefits-career-path-guide.pdf,,,tertiary,doc,1
General,Uncategorized,URLs,URL,Financial Modeling Defined - Oracle,www.oracle.com,https://www.oracle.com/erp/cfo/financial-modeling/,,,tertiary,doc,1
Compliance,Risk,URLs,URL,"Different Types of Audits | Internal, Financial, & More - Patriot Software",www.patriotsoftware.com,https://www.patriotsoftware.com/blog/accounting/different-types-of-audit/,,,tertiary,doc,1
General,Uncategorized,URLs,URL,Accounts Receivable Factoring: Solving Cash Flow Challenges,www.paystand.com,https://www.paystand.com/blog/accounts-receivable-factoring,,,tertiary,doc,1
Business,Finance,URLs,URL,How to Price Innovative New Products - Pricing Solutions,www.pricingsolutions.com,https://www.pricingsolutions.com/pricing-blog/pricing-model-for-new-products/,,,tertiary,doc,1
Wealth,Management,URLs,URL PDF,Family Offices - Priwexus,www.priwexus.com,https://www.priwexus.com/wp-content/uploads/2017/05/Family-Office-Handbook.pdf,,,tertiary,doc,1
General,Uncategorized,URLs,URL,"Diagnostic and Statistical Manual of Mental Disorders, 5th Edition",www.qeios.com,https://www.qeios.com/read/TAIKY6/pdf,,,tertiary,doc,1
Markets,Investing,URLs,URL,Capital Structure: Optimize Your Debt-to-Equity Mix | re:cap,www.re-cap.com,https://www.re-cap.com/blog/capital-structure,,,tertiary,doc,1
Credentials,Professional,URLs,URL,"Looking for CFA Level 1, 2, and 3 Syllabus PDFs + YouTube ...",www.reddit.com,https://www.reddit.com/r/CFA/comments/1p9ilqp/looking_for_cfa_level_1_2_and_3_syllabus_pdfs/,,,tertiary,doc,1
Wealth,Planning,URLs,URL,"American College for Financial Services - CFP, ChFC, MSFP - Reddit",www.reddit.com,https://www.reddit.com/r/CFP/comments/190eflc/american_college_for_financial_services_cfp_chfc/,,,tertiary,doc,1
Wealth,Planning,URLs,URL,CHFC Study Guide : r/CFP - Reddit,www.reddit.com,https://www.reddit.com/r/CFP/comments/1ex4i03/chfc_study_guide/,,,tertiary,doc,1
Markets,Investing,URLs,URL,Mortgage broker (Loan Officer) vs Financial Advisor : r/CFP - Reddit,www.reddit.com,https://www.reddit.com/r/CFP/comments/1inwwo7/mortgage_broker_loan_officer_vs_financial_advisor/,,,tertiary,doc,1
Wealth,Planning,URLs,URL,Which study materials are recommended? : r/CFP - Reddit,www.reddit.com,https://www.reddit.com/r/CFP/comments/ok4lai/which_study_materials_are_recommended/,,,tertiary,doc,1
Markets,Private,URLs,URL,can anyone explain what a hedge fund manager is and the path to ...,www.reddit.com,https://www.reddit.com/r/FinancialCareers/comments/1p4madq/can_anyone_explain_what_a_hedge_fund_manager_is/,,,tertiary,doc,1
Professional,Career,URLs,URL,What does a Client Service Associate at JP Morgan do? - Reddit,www.reddit.com,https://www.reddit.com/r/FinancialCareers/comments/oiuh21/what_does_a_client_service_associate_at_jp_morgan/,,,tertiary,doc,1
Credit,Consumer,URLs,URL,Corporate/Commercial credit as a career? : r/FinancialCareers,www.reddit.com,https://www.reddit.com/r/FinancialCareers/comments/x8xeox/corporatecommercial_credit_as_a_career/,,,tertiary,doc,1
Banking,General,URLs,URL,Can someone explain Infinite Banking concept with life insurance?,www.reddit.com,https://www.reddit.com/r/LifeInsurance/comments/110sxj6/can_someone_explain_infinite_banking_concept_with/,,,tertiary,doc,1
General,Uncategorized,URLs,URL,In-House Counsel (Securities) : r/biglaw - Reddit,www.reddit.com,https://www.reddit.com/r/biglaw/comments/1f1u0sp/inhouse_counsel_securities/,,,tertiary,doc,1
Wealth,Management,URLs,URL,"Senior Client Services - Wealth Management Job in San Jose, CA",www.roberthalf.com,https://www.roberthalf.com/us/en/job/san-jose-ca/senior-client-services-wealth-management/00412-9504268078-usen,,,tertiary,doc,1
Wealth,Planning,URLs,URL,Rockefeller Philanthropy Advisors: Home,www.rockpa.org,https://www.rockpa.org,,,tertiary,doc,1
Tax,General,URLs,URL,4 Pricing Strategies That Can Turn Innovation Into Revenue,www.salesforce.com,https://www.salesforce.com/blog/innovation-product-pricing-matters/,,,secondary,doc,1
Credit,Consumer,URLs,URL,Establish business credit | U.S. Small Business Administration,www.sba.gov,https://www.sba.gov/business-guide/plan-your-business/establish-business-credit,,,tertiary,doc,1
Banking,General,URLs,URL,Loans | U.S. Small Business Administration,www.sba.gov,https://www.sba.gov/funding-programs/loans,,,tertiary,doc,1
Banking,General,URLs,URL,7(a) loans | U.S. Small Business Administration,www.sba.gov,https://www.sba.gov/funding-programs/loans/7a-loans,,,tertiary,doc,1
Banking,General,URLs,URL,Become an SBA lender | U.S. Small Business Administration,www.sba.gov,https://www.sba.gov/partners/lenders/become-sba-lender,,,tertiary,doc,1
Retirement,Planning,URLs,URL,"Retirement Plans ERISA Compliance, Manager | Schwab Jobs",www.schwabjobs.com,https://www.schwabjobs.com/job/westlake/retirement-plans-erisa-compliance-manager/33727/90429381472,,,tertiary,doc,1
Credentials,Professional,URLs,URL,CFA Level 1 Exam Prep - Kaplan Schweser,www.schweser.com,https://www.schweser.com/cfa/level-1,,,tertiary,doc,1
General,Uncategorized,URLs,URL,“Family business”: Does the family structure affect the performance of listed companies?,www.scielo.br,https://www.scielo.br/j/ram/a/T78LXLdygYGhvJScRXwBSmQ/?format=pdf&lang=en,,,tertiary,doc,1
General,Uncategorized,URLs,URL,The Relationship between Manager Responsibility and Organizational Rules and Procedures,www.sciendo.com,https://www.sciendo.com/article/10.2478/picbe-2025-0330,,,tertiary,doc,1
Wealth,Planning,URLs,URL,Certified Financial Planner Program - Leavey School of Business,www.scu.edu,https://www.scu.edu/execed/cfp/,,,tertiary,doc,1
Wealth,Planning,URLs,URL,The Top Business Coach for Financial Services Professionals,www.selectadvisorsinstitute.com,https://www.selectadvisorsinstitute.com/our-perspective/top-financial-services-business-coach,,,tertiary,doc,1
General,Uncategorized,URLs,URL,Call Center Operations: Profiting from Teleservices,www.semanticscholar.org,https://www.semanticscholar.org/paper/092bb6c5a77442d66315652c91fc7cef6b65319b,,,tertiary,doc,1
Credit,Consumer,URLs,URL,A study of for-credit introductory personal financial planning courses.,www.semanticscholar.org,https://www.semanticscholar.org/paper/0b7a10b2eff4001197a2c65ebe8c5e00db03ecac,,,tertiary,doc,1
Wealth,Management,URLs,URL,A Wealth of Opportunity: CPAs Can Expand Their Practice by Helping Clients Assemble and Monitor Financial Management Teams,www.semanticscholar.org,https://www.semanticscholar.org/paper/1423bf6ca535b5fc81674c7b4f855ff5959982dd,,,tertiary,doc,1
Banking,General,URLs,URL,"How does ownership structure and manager wealth influence risk? : a look at ownership structure, manager wealth, and risk in commercial banks",www.semanticscholar.org,https://www.semanticscholar.org/paper/21e781bfb5249917ebd4378084f41cac04a4367f,,,tertiary,doc,1
General,Uncategorized,URLs,URL,Leveraging Library Expertise in Support of Institutional Goals: A Case Study of an OER Initiative at Lehman College,www.semanticscholar.org,https://www.semanticscholar.org/paper/26ed6b21243e9635d83bcd3fdd49b17345a74f6d,,,tertiary,doc,1
Retirement,Planning,URLs,URL,Determining the Death Beneficiary Under an ERISA Plan and the Rights of Such a Beneficiary,www.semanticscholar.org,https://www.semanticscholar.org/paper/270298fad7245be0e612548310674a0823d8002d,,,tertiary,doc,1
Insurance,General,URLs,URL,Employee Benefits Law - Drunk Driving Fatality Determined Not Accidental under ERISA-Governed Insurance Plan - Stamp V. Metropolitan Life Insurance Co,www.semanticscholar.org,https://www.semanticscholar.org/paper/2797a3bb1173becfbc1d693a1b3d63b09a844641,,,tertiary,doc,1
Banking,General,URLs,URL,Corporate Governance Structures and Financial Performance of Selected Indian Banks,www.semanticscholar.org,https://www.semanticscholar.org/paper/386fd17da931e45c0875b224ae9cbd22c744b5cc,,,tertiary,doc,1
Credentials,Professional,URLs,URL,Practice Makes Perfect; Brush Up for the CPA Exam with a Review Course,www.semanticscholar.org,https://www.semanticscholar.org/paper/392755a6375613c3c3f2b9d8803f496efbeb77b4,,,tertiary,doc,1
General,Uncategorized,URLs,URL,Customer relations management: call center operations: fluid approximations for a priority call center with time-varying arrivals,www.semanticscholar.org,https://www.semanticscholar.org/paper/3e560652c0bbcddc4ab2f02139ae63905004edf7,,,tertiary,doc,1
General,Uncategorized,URLs,URL,The Role of the Chief Executive Officer in Firm Environmental Decisions,www.semanticscholar.org,https://www.semanticscholar.org/paper/4656664965ebd90e24bf16a8fd6b5f26218cefc2,,,tertiary,doc,1
General,Uncategorized,URLs,URL,"EDUCATIONAL PRACTICES AND CHALLENGES OF STUDENTS WITH HEARING IMPAIRMENT IN ARBA MINCH COLLEGE OF TEACHERS EDUCATION, SOUTH ETHIOPIA",www.semanticscholar.org,https://www.semanticscholar.org/paper/4d8956f29c0da1007b4e7816bd4dd8e76e89ef3c,,,tertiary,doc,1
Estate,Planning,URLs,URL,Research Guides: Study Aid Publications & Resources: 2L/3L Courses: Real Estate Transactions to White Collar Crime,www.semanticscholar.org,https://www.semanticscholar.org/paper/591fea984c4f8d4f6b63f6a92282ed27221afb1e,,,tertiary,doc,1
General,Uncategorized,URLs,URL,Implementación del sistema de información KEYMA y su efecto en las ventas de servicio en el Call center del CDA P900 la terminal,www.semanticscholar.org,https://www.semanticscholar.org/paper/5bd27206593b877efc4bea1900295419370bd7da,,,tertiary,doc,1
General,Uncategorized,URLs,URL,Customer relations management: call center operations: modelling and simulation of a telephone call center,www.semanticscholar.org,https://www.semanticscholar.org/paper/648810197bbe0ef81a783b8b3bc7731e00f8bca2,,,tertiary,doc,1
Wealth,Management,URLs,URL,Vice President and Senior Wealth Strategist,www.semanticscholar.org,https://www.semanticscholar.org/paper/7af577f21e4b22eee7aa7b1cfd3081a80c3229d2,,,tertiary,doc,1
General,Uncategorized,URLs,URL,OF LABOR Employee Benefits Security Administration 29 CFR Parts 2520 and 2590,www.semanticscholar.org,https://www.semanticscholar.org/paper/7d964c8c3d1e252eb2e627fb2bf538f4e2762072,,,tertiary,doc,1
Estate,Planning,URLs,URL,Estate of Wall V. Commissioner: An Answer to the Problem of Settlor Standing in Trust Law?,www.semanticscholar.org,https://www.semanticscholar.org/paper/7e4a4492cf7bef2f1f801bcbc617b81216346961,,,tertiary,doc,1
General,Uncategorized,URLs,URL,A comparative study of African-American males vs females at a minority institute of higher learning and the role of Supplemental Instruction,www.semanticscholar.org,https://www.semanticscholar.org/paper/804413e70e5a6f8e9f1fe8d46ef5a381629f782f,,,tertiary,doc,1
Technology,FinTech,URLs,URL,Critical Infrastructure Cybersecurity : A Review of Recent Threats and Violations,www.semanticscholar.org,https://www.semanticscholar.org/paper/877c95663ad2db4845d49ed24365b4fe2584dd8e,,,tertiary,doc,1
Compliance,General,URLs,URL,"Know Your Customer (KYC) Norms/ Anti- Money Laundering (AML) Standards/ Combating of Financing of Terrorism (CFT) As part of its ongoing review of compliance with the AML/CFT standards, the Financial Action Task Force (FATF) has identified certain jurisdictions which",www.semanticscholar.org,https://www.semanticscholar.org/paper/8af41a6836e5ff40a6d51594d85b8bdea2dd3ad5,,,tertiary,doc,1
Credentials,Professional,URLs,URL,Research Guides: Study Aid Publications & Resources: Bar Exam Materials,www.semanticscholar.org,https://www.semanticscholar.org/paper/8c10ce99f45b93f671b78ca3b45fe3c033e64e26,,,tertiary,doc,1
General,Uncategorized,URLs,URL,Sobering Issues Dominate Industry Meeting,www.semanticscholar.org,https://www.semanticscholar.org/paper/8cad6d2cdebf31c95c143adf2dc3412f81b4d001,,,tertiary,doc,1
Wealth,Planning,URLs,URL,Alphabet Soup: Financial Planning Designations and What They Mean,www.semanticscholar.org,https://www.semanticscholar.org/paper/8d1903dde15b3b8d4d34ae7cdd456fdc47b967c1,,,tertiary,doc,1
General,Uncategorized,URLs,URL,Determinants of Call Center Agents’ Performance: In Response to Business Processing Operations in the Philippines,www.semanticscholar.org,https://www.semanticscholar.org/paper/8fa76f1e5796c4e9c2b0b81672a307786933c365,,,tertiary,doc,1
General,Uncategorized,URLs,URL,Increasing Customer Satisfaction Through Employee Satisfaction in a Call Center Environment,www.semanticscholar.org,https://www.semanticscholar.org/paper/91018bf8e89d17d9c24c0402df9f150277af1bb2,,,tertiary,doc,1
Insurance,General,URLs,URL,Research Guides: Study Aid Publications & Resources: 2L/3L Courses: Disability Law to Insurance Law,www.semanticscholar.org,https://www.semanticscholar.org/paper/9aa4d475b716f30713e4071c5e36a3072c5f0afc,,,tertiary,doc,1
Credentials,Professional,URLs,URL,"'Why Are You Not a CPA?' Taking the CPA Exam Gives an Accounting Professor New Ideas for Bridging the Gap between Practitioners, Students, and Academics",www.semanticscholar.org,https://www.semanticscholar.org/paper/a1d0c5a35b57ff65a5f266d0789b4436808bf369,,,tertiary,doc,1
Credentials,Professional,URLs,URL,IC3: Internet and Computing Core Certification Global Standard 4 Study Guide,www.semanticscholar.org,https://www.semanticscholar.org/paper/a4b0752e51df9732a66224ae246b519cbe14e763,,,tertiary,doc,1
General,Uncategorized,URLs,URL,OF LABOR Employee Benefits Security Administration 29 CFR Parts 2509 and 2550,www.semanticscholar.org,https://www.semanticscholar.org/paper/b089777c86e001f81327a711f2c31e166332ce5e,,,tertiary,doc,1
General,Uncategorized,URLs,URL,BOARD STRUCTURE AND FINANCIAL PERFORMANCE OF LISTED FIRMS IN NAIROBI SECURITIES EXCHANGE. THE MODERATING EFFECT OF CHIEF EXECUTIVE OFFICER’S POWER,www.semanticscholar.org,https://www.semanticscholar.org/paper/b3d3f4a8f971356aee1f99574b29bd6e2f4d89df,,,tertiary,doc,1
Credentials,Professional,URLs,URL,The Complete One-Week Preparation for the CISCO CCENT/CCNA ICND1 Exam 640-822: A Certification Guide Based over 2000 Sample Questions and Answers with Explanations,www.semanticscholar.org,https://www.semanticscholar.org/paper/b40c27946ad5b9f1d34fb711bbc7f5860b36209c,,,tertiary,doc,1
Banking,General,URLs,URL,A Study of the Soft Power Model of the Wealth-Management Manager of Commercial Bank,www.semanticscholar.org,https://www.semanticscholar.org/paper/b8641073f4d4948a3422c6c70cd0481c219596f3,,,tertiary,doc,1
Tax,General,URLs,URL,"Employee Retirement Income Security Act of 1974: rules and regulations for administration and enforcement; claims procedure. Pension and Welfare Benefits Administration, Labor. Final regulation.",www.semanticscholar.org,https://www.semanticscholar.org/paper/bbbcf321fcad84f03fa59fda83ad4f9af32f1fda,,,secondary,doc,1
General,Uncategorized,URLs,URL,From Measurement to Management: The Influence of IT on Service Operations,www.semanticscholar.org,https://www.semanticscholar.org/paper/c642cad350b56f95bbf15de88fb942962ee05709,,,tertiary,doc,1
General,Uncategorized,URLs,URL,A comparative study of African-American males vs females at a minority institute of higher learning and the role of Supplemental Instruction,www.semanticscholar.org,https://www.semanticscholar.org/paper/cc696e9ef87660c1a3458a0a82c95bb50e43e938,,,tertiary,doc,1
Markets,Investing,URLs,URL,PolyModel for Hedge Funds' Portfolio Construction Using Machine Learning,www.semanticscholar.org,https://www.semanticscholar.org/paper/cf656259158ba272d4e045616f2fda1fab00bb48,,,tertiary,doc,1
Tax,General,URLs,URL,"Legal position of the FDC, its board, chief executive officer, company secretary, MEC for Tourism, Environmental and Economic Affairs, and MEC for Finance and Expenditure : Part 1",www.semanticscholar.org,https://www.semanticscholar.org/paper/d37d02a83504a24294575fea09a15e9aff4aadd3,,,secondary,doc,1
General,Uncategorized,URLs,URL,"Production , Manufacturing and Logistics Competition and market segmentation of the call center service supply chain",www.semanticscholar.org,https://www.semanticscholar.org/paper/d510ac95ec867abc4b275093647f54e3276191b8,,,tertiary,doc,1
Professional,Career,URLs,URL,Research Guides: Study Aid Publications & Resources: 2L/3L Courses: Intellectual Property to Professional Responsibility,www.semanticscholar.org,https://www.semanticscholar.org/paper/ddb0348dd039afcfee362d57b8ccff7cc67c9747,,,tertiary,doc,1
General,Uncategorized,URLs,URL,A Case Study Of Teaching Research Methods In Health Promotion To African American Doctoral Students,www.semanticscholar.org,https://www.semanticscholar.org/paper/de4b20d899fd863ba66df47cf984afc0b58ef2fa,,,tertiary,doc,1
Tax,General,URLs,URL,"College Savings Plans, Financial Aid, and Tax Strategy.",www.semanticscholar.org,https://www.semanticscholar.org/paper/e0892827bb677d2a77dbfc9e654b46cb1357caf2,,,secondary,doc,1
Credentials,Professional,URLs,URL,OCA / OCP Java SE 8 Programmer Certification Kit: Exam 1Z0-808 and Exam 1Z0-809,www.semanticscholar.org,https://www.semanticscholar.org/paper/e27bfad311cc356d326c88b2fb34f005a3dc6476,,,tertiary,doc,1
Banking,General,URLs,URL,Chapter 4: Commercial Banking as a Business,www.semanticscholar.org,https://www.semanticscholar.org/paper/e5a8cc00571a4f765bc6611bf950352eb117ea3a,,,tertiary,doc,1
Retirement,Planning,URLs,URL,"A Power Struggle of Mythic Proportion: In the World of ERISA, are Retirement Plan Administrators the Real Gods of Olympus?",www.semanticscholar.org,https://www.semanticscholar.org/paper/ed658bd39ee788e08fb14178df95ca019f7a9012,,,tertiary,doc,1
Tax,General,URLs,URL,uCertify Guide for Oracle Exam 1Z0-047: Pass your Oracle Database SQL Expert certification exam in first attempt,www.semanticscholar.org,https://www.semanticscholar.org/paper/edb816cea0fd9b920ecc84ca995a2901d3febc89,,,secondary,doc,1
Retirement,Planning,URLs,URL,Supreme Court Endorses Broad ERISA Preemption of Pure Eligibility Determinations by Plan Administrator; Federal Court the Exclusive Forum for Such Claims; Overlapping State Law Causes of Action Not Permitted,www.semanticscholar.org,https://www.semanticscholar.org/paper/ef9013492a38a8b38144156d7990577e683c7d0f,,,tertiary,doc,1
Credentials,Professional,URLs,URL,Assessing LLMs'Performance: Insights from the Chinese Pharmacist Exam,www.semanticscholar.org,https://www.semanticscholar.org/paper/f51cddab451a59f3acf7f2209fc15593117bf042,,,tertiary,doc,1
Compliance,Risk,URLs,URL,Mitigating Undiscovered Risks,www.semanticscholar.org,https://www.semanticscholar.org/paper/f56143d2d9dbb2aeb87b7a6abb8463a973e4a8db,,,tertiary,doc,1
General,Uncategorized,URLs,URL,Traditional Rulers and leadership : A Focus Ikono People of Nigeria,www.semanticscholar.org,https://www.semanticscholar.org/paper/fcf0d53769edf164d4b09b6c0f3743b8447d8e8a,,,tertiary,doc,1
Retirement,Planning,URLs,URL,Garnishment of Pension Benefits After ERISA,www.semanticscholar.org,https://www.semanticscholar.org/paper/ff9a5c622a402fd4680dfa6e90116c83f99bc413,,,tertiary,doc,1
Wealth,Management,URLs,URL,Research on the Mechanism of Family Business Internal Governance Structure’s Influence on Wealth Management Decisions,www.shs-conferences.org,https://www.shs-conferences.org/10.1051/shsconf/202521301027,,,tertiary,doc,1
Compliance,General,URLs,URL,What is an AML Compliance Officer? - SmartSearch,www.smartsearch.com,https://www.smartsearch.com/resources/blog/what-is-an-aml-compliance-officer,,,tertiary,doc,1
Compliance,General,URLs,URL,General Counsel vs. Chief Compliance Officer: Key Differences and ...,www.spotdraft.com,https://www.spotdraft.com/blog/general-counsel-vs-chief-compliance-officer-differences,,,tertiary,doc,1
